<?xml version="1.0" encoding="Windows-1252"?>
<xs:schema xmlns="http://www.uniovi.es" elementFormDefault="qualified" targetNamespace="http://www.uniovi.es" xmlns:xs="http://www.w3.org/2001/XMLSchema">
  <xs:element name="persona">
    <xs:complexType>
      <xs:sequence>
        <xs:element ref="lugarNacimiento" />
        <xs:element ref="lugarResidencia" />
        <xs:element ref="fotografias" />
        <xs:element ref="videos" />
        <xs:element ref="comentarios" />
        <xs:sequence minOccurs="0" maxOccurs="1">
          <xs:element ref="persona" />
          <xs:element ref="persona" />
          <xs:element ref="persona" />
        </xs:sequence>
      </xs:sequence>
      <xs:attribute name="nombre" type="xs:string" use="required" />
      <xs:attribute name="apellidos" type="xs:string" use="required" />
      <xs:attribute name="fechaNacimiento" type="xs:string" use="required" />
    </xs:complexType>
  </xs:element>
  <xs:element name="lugarNacimiento">
    <xs:complexType>
      <xs:sequence>
        <xs:element ref="coordenadas" />
      </xs:sequence>
      <xs:attribute name="nombre" type="xs:string" use="required" />
    </xs:complexType>
  </xs:element>
  <xs:element name="lugarResidencia">
    <xs:complexType>
      <xs:sequence>
        <xs:element ref="coordenadas" />
      </xs:sequence>
      <xs:attribute name="nombre" type="xs:string" use="required" />
    </xs:complexType>
  </xs:element>
  <xs:element name="coordenadas">
    <xs:complexType>
      <xs:simpleContent>
        <xs:extension base="xs:string">
          <xs:attribute name="latitud" type="xs:string" use="required" />
          <xs:attribute name="longitud" type="xs:string" use="required" />
          <xs:attribute name="altitud" type="xs:string" use="required" />
        </xs:extension>
      </xs:simpleContent>
    </xs:complexType>
  </xs:element>
  <xs:element name="fotografias">
    <xs:complexType>
      <xs:sequence>
        <xs:element minOccurs="1" maxOccurs="unbounded" ref="fotografia" />
      </xs:sequence>
    </xs:complexType>
  </xs:element>
  <xs:element name="fotografia">
    <xs:complexType>
      <xs:simpleContent>
        <xs:extension base="xs:string">
          <xs:attribute name="enlace" type="xs:string" use="required" />
        </xs:extension>
      </xs:simpleContent>
    </xs:complexType>
  </xs:element>
  <xs:element name="videos">
    <xs:complexType>
      <xs:sequence>
        <xs:element minOccurs="0" maxOccurs="unbounded" ref="video" />
      </xs:sequence>
    </xs:complexType>
  </xs:element>
  <xs:element name="video">
    <xs:complexType>
      <xs:simpleContent>
        <xs:extension base="xs:string">
          <xs:attribute name="enlace" type="xs:string" use="required" />
        </xs:extension>
      </xs:simpleContent>
    </xs:complexType>
  </xs:element>
  <xs:element name="comentarios">
    <xs:complexType>
      <xs:sequence>
        <xs:element minOccurs="0" maxOccurs="unbounded" ref="comentario" />
      </xs:sequence>
    </xs:complexType>
  </xs:element>
  <xs:element name="comentario">
    <xs:complexType>
      <xs:simpleContent>
        <xs:extension base="xs:string">
          <xs:attribute name="comentario" type="xs:string" use="required" />
        </xs:extension>
      </xs:simpleContent>
    </xs:complexType>
  </xs:element>
</xs:schema>